<?xml version="1.0" encoding="UTF-8"?>
<domainmodel xmlns:xsi="http://www.w3.org/2001/XMLSchema-instance"
    xsi:noNamespaceSchemaLocation="domain.xsd">

    <resort type="Sacred Mountain" season="Spring">
        <name>Mount. Tai</name>
        <desc>Located in Shandong, one of the so-called '5 mount'</desc>
        <pic_url>pic/taishan.jpg</pic_url>
        <food taste="Sweet">
            <name>Youtiao</name>
            <desc>Very long and crispy</desc>
        </food>
    </resort>

</domainmodel>